Name,Price,Location,City,State,Country,Type,Foundation,Misc,Bedrooms,Lofts,Bathrooms,Size,Days on site,Number of views,Length,Width,Times dreamlisted,Link
40' Off Grid Smart Home,95000,"Elwoo, Utah, United States",Elwoo,Utah,United States,Container Home,Mobile,Delivery Available,2,0,1,320.0,166,0,40.0,8.0,178.0,https://tinyhouselistings.com/listings/40-off-grid-smart-home-container_home
"Toy hauler, excellent condition, 27’, lots of fun",26500,"Arivaca , Arizona, United States",Arivaca ,Arizona,United States,Camper,Mobile,Used,1,0,1,216.0,167,0,27.0,8.0,39.0,https://tinyhouselistings.com/listings/toy-hauler-excellent-condition-27-lots-of-fun
Grand Champion 24' Tiny House on wheels,62000,"Bandera, Texas, United States",Bandera,Texas,United States,Tiny House,Mobile,New,2,2,1,192.0,168,0,24.0,8.5,378.0,https://tinyhouselistings.com/listings/grand-champion-24-tiny-house-on-wheels
Off-Grid 32' Tiny House On Wheels for Sale,85000,"Spring Grove, Pennsylvania, United States",Spring Grove,Pennsylvania,United States,Tiny House,Mobile,Used,2,2,1,240.0,170,0,30.0,8.0,110.0,https://tinyhouselistings.com/listings/off-grid-32-tiny-house-on-wheels-for-rent-or-sale
Amazing Grace,29900,"Industry , Pennsylvania, United States",Industry ,Pennsylvania,United States,Tiny House,Mobile,Used,0,2,1,160.0,173,0,20.0,8.5,149.0,https://tinyhouselistings.com/listings/amazing-grace
ARCHV,39000,"Norman, Oklahoma, United States",Norman,Oklahoma,United States,Park Model,Mobile,Delivery Available,1,0,1,160.0,174,0,20.0,8.0,208.0,https://tinyhouselistings.com/listings/archv-park_model
Top-Of-The-Line 2001 Winnebago Ultimate Freedom 40-JD,53000,"Mount Pleasant, Texas, United States",Mount Pleasant,Texas,United States,RV,Mobile,Delivery Available,1,0,1,320.0,175,0,40.0,8.0,145.0,https://tinyhouselistings.com/listings/top-of-the-line-2001-winnebago-ultimate-freedom-40-wd
"INTENTIONAL Tiny House - EMF Resistant, Micro Office with Full Roof Skylight",12500,"Pittsburgh, Pennsylvania, United States",Pittsburgh,Pennsylvania,United States,Tiny House,Mobile,Delivery Available,0,1,0,60.0,176,0,10.0,6.0,22.0,https://tinyhouselistings.com/listings/intentional-tiny-house-emf-resistant-micro-office-with-full-roof-skylight
New Tiny home,22000,"El Cajon , California, United States",El Cajon ,California,United States,Tiny House,Mobile,New,1,1,1,18.0,177,0,18.0,8.0,193.0,https://tinyhouselistings.com/listings/new-tiny-home-67cca016-8ce9-44e9-8532-1495a4673356
30' ft Custom off grid Tiny House on Wheels,65000,"Flagstaff, Arizona, United States",Flagstaff,Arizona,United States,Tiny House,Mobile,Delivery Available,1,1,1,280.0,173,0,30.0,8.5,230.0,https://tinyhouselistings.com/listings/30-ft-custom-off-grid-tiny-house-on-wheels
Off-Grid Tiny House For Sale.,75000,"Spring Grove, Pennsylvania, United States",Spring Grove,Pennsylvania,United States,Tiny House,Mobile,Dual Lofts,1,2,1,272.0,180,0,32.0,8.5,116.0,https://tinyhouselistings.com/listings/off-grid-tiny-house-for-sale
Tiny House - can be moved -10ft.x16ft,24000,"Bangor, Pennsylvania, United States",Bangor,Pennsylvania,United States,Tiny House,Mobile,Delivery Available,0,1,1,160.0,180,0,16.0,10.0,272.0,https://tinyhouselistings.com/listings/tiny-house-can-be-moved-or-converted-to-moible-10ft-x16ft
Dutch houseboat style Tiny House on Wheels,21000,"Huachuca City, Arizona, United States",Huachuca City,Arizona,United States,Tiny House,Mobile,Delivery Available,0,2,1,160.0,182,0,20.0,8.0,102.0,https://tinyhouselistings.com/listings/dutch-houseboat-style-tiny-house-on-wheels
Firefly,25000,"Washington, Missouri, United States",Washington,Missouri,United States,Tiny House,Mobile,Used,1,1,1,208.0,182,0,25.0,8.0,118.0,https://tinyhouselistings.com/listings/firefly-tiny_house
Off Grid Sustainable Smart Homes,95000,"Elwood, Utah, United States",Elwood,Utah,United States,Container Home,Mobile,New,1,0,2,320.0,182,0,40.0,8.0,72.0,https://tinyhouselistings.com/listings/off-grid-sustainable-smart-homes
40' Off Grid Smart Home,95000,"Elwood, Utah, United States",Elwood,Utah,United States,Container Home,Stationary,New,2,0,1,320.0,0,0,40.0,8.0,12.0,https://tinyhouselistings.com/listings/40-off-grid-smart-home
Craftsman Tiny House,75000,"Torrington, Wyoming, United States",Torrington,Wyoming,United States,Tiny House,Floating,Delivery Available,2,2,1,293.0,183,0,24.0,8.0,102.0,https://tinyhouselistings.com/listings/craftsman-tiny-house-tiny_house-floating
Spacious Tiny House,34500,"PUEBLO WEST, Colorado, United States",PUEBLO WEST,Colorado,United States,Tiny House,Mobile,New,1,0,1,200.0,184,0,20.0,10.0,113.0,https://tinyhouselistings.com/listings/spacious-tiny-house-tiny_house-stationary-purchase
"Beautiful, New 23x8 Tiny House",46500,"Penn Yan, New York, United States",Penn Yan,New York,United States,Tiny House,Mobile,New,1,1,1,160.0,187,0,23.0,8.0,286.0,https://tinyhouselistings.com/listings/beautiful-new-23x8-tiny-house
Tiny cabin,5500,"Waynesboro, Virginia, United States",Waynesboro,Virginia,United States,Tiny House,Mobile,New,1,0,1,40.0,192,0,8.0,5.0,61.0,https://tinyhouselistings.com/listings/micro-cabin-tiny_house_trailer
Elegant Tiny House,97000,"Covington, Washington, United States",Covington,Washington,United States,Tiny House,Mobile,Delivery Available,1,2,1,168.0,192,0,24.0,7.0,137.0,https://tinyhouselistings.com/listings/elegant-tiny-house
Award Winning Custom Tiny Home For Sale,87000,"Carrollton, Georgia, United States",Carrollton,Georgia,United States,Other,Mobile,Used,1,1,1,200.0,193,0,24.5,8.0,80.0,https://tinyhouselistings.com/listings/award-winning-custom-tiny-home-for-sale
Beautiful Unique Tiny House on Wheels,49000,"Port Townsend, Washington, United States",Port Townsend,Washington,United States,Converted Bus,Mobile,Used,2,2,0,150.0,195,0,18.75,8.0,218.0,https://tinyhouselistings.com/listings/beautiful-unique-house-bus
10 Foot Ceiling Park Model RV,62900,"Mansfield, Texas, United States",Mansfield,Texas,United States,Park Model,Stationary,New,1,0,1,399.0,198,0,36.0,15.0,410.0,https://tinyhouselistings.com/listings/10-foot-ceiling-park-model-rv
THE ALT 20' Luxury Flagship Container home on wheels!,59800,"Las Vegas, Nevada, United States",Las Vegas,Nevada,United States,Container Home,Mobile,Delivery Available,0,0,1,160.0,203,0,20.0,8.0,34.0,https://tinyhouselistings.com/listings/the-alt-20-luxury-flagship-container-home-on-wheels
Tiny house 90% complete- Ready for finishing!,45000,"Delta, Ontario, Canada",Delta,Ontario,Canada,Tiny House,Mobile,New,1,1,1,200.0,204,0,24.0,8.0,32.0,https://tinyhouselistings.com/listings/tiny-house-90-complete-ready-for-finishing
Modern Tiny Cabin on Wheels- Take Me To Your Favorite Place,22990,"Walsenburg, Colorado, United States",Walsenburg,Colorado,United States,Tiny House,Mobile,Delivery Available,0,1,1,163.0,207,0,16.0,8.0,203.0,https://tinyhouselistings.com/listings/modern-tiny-cabin-on-wheels-take-me-to-your-favorite-place
Brand New Off-Grid Capable Gorgeous Tiny House on Wheels,80000,"Gilbert , Arizona, United States",Gilbert ,Arizona,United States,Tiny House,Mobile,New,1,1,1,200.0,192,0,24.0,8.0,250.0,https://tinyhouselistings.com/listings/brand-new-off-grid-capable-gorgeous-tiny-house-on-wheels
New container Tiny Home studio or Office. 15% Discount,25075,"Valencia, California, United States",Valencia,California,United States,Tiny House,Stationary,New,1,0,0,160.0,217,0,20.0,8.0,48.0,https://tinyhouselistings.com/listings/new-container-tiny-home-studio-or-office
Brand new tiny home for sale,40000,"Atlanta, Georgia, United States",Atlanta,Georgia,United States,Tiny House,Mobile,New,1,2,1,0.0,221,0,24.0,8.0,425.0,https://tinyhouselistings.com/listings/brand-new-tiny-home-for-sale-tiny_house
Quaint Cottage,41600,"Duewest, South Carolina, United States",Duewest,South Carolina,United States,Tiny House,Stationary,New,0,2,1,264.0,223,0,28.0,12.0,272.0,https://tinyhouselistings.com/listings/quaint-cottage
Traditional Mongolian Yurt (ger),7200,"Flagstaff, Arizona, United States",Flagstaff,Arizona,United States,Other,Mobile,New,1,0,0,285.0,221,0,,,79.0,https://tinyhouselistings.com/listings/traditional-mongolian-yurt-ger-other
The ARION a Roof top deck tiny house,88620,"emmett, Idaho, United States",emmett,Idaho,United States,Tiny House,Mobile,Delivery Available,2,2,1,208.0,224,0,26.0,8.6,958.0,https://tinyhouselistings.com/listings/the-arion-a-roof-top-deck-tiny-house
The Joshua Tree,70000,"Bend, Oregon, United States",Bend,Oregon,United States,Tiny House,Mobile,Delivery Available,2,1,1,231.0,225,0,26.0,8.5,689.0,https://tinyhouselistings.com/listings/spindrift-presents-joshua-tree-tiny-home
Rustic Tiny Dream Home,55000,"Marble Falls, Texas, United States",Marble Falls,Texas,United States,Tiny House,Mobile,Used,1,2,1,170.0,228,0,20.0,8.5,42.0,https://tinyhouselistings.com/listings/rustic-tiny-dream-home
2017 Platinum Tiny Cottage,59900,"Wylie, Texas, United States",Wylie,Texas,United States,Tiny House,Mobile,Used,1,0,1,399.0,230,0,44.0,11.5,411.0,https://tinyhouselistings.com/listings/2017-platinum-tiny-cottage
Duramax Tiny Home 8.5' x 20' Gable Roof Shell,7599,"Commerce, California, United States",Commerce,California,United States,Tiny House Shell,Stationary,New,1,0,0,169.0,230,0,20.0,8.5,55.0,https://tinyhouselistings.com/listings/duramax-tiny-home-8-5-x-20-gable-roof-shell
